{
  "schema_version": "6.3",
  "overview_id": "ov-20260806-001",
  "source": { "type": "text", "ref": "inline://demo", "read_at": "2026-08-06T02:00:00.000Z" },
  "source_fingerprint": "sha256:deadbeef01",
  "base_commit": "local:abc12345",
  "changeset_hash": "sha256:cset0001",
  "created_at": "2026-08-06T02:00:00.000Z",
  "degrade_mode": null,
  "modules": [
    { "module_l1": "销售", "module_l2": "销售", "pages": ["销售单列表页"] }
  ],
  "items": [
    {
      "change_id": "CH-001",
      "operation": "add",
      "module_l1": "销售",
      "module_l2": "销售",
      "page_id": "销售单列表页",
      "platform": "web",
      "summary": "补充 Web 列表 URL",
      "selected": true
    }
  ],
  "conflicts": [],
  "skipped": [
    { "reason": "single_case_data", "summary": "跳过单条数据准备步骤" }
  ]
}
